item_number,description,category
twn311,"Manager, Dark Purple Legs",Town
twn102,"Mannequin, Bride",Town
twn101,"Mannequin, Groom",Town
bb0002,Mary,Town
twn155,Mayor,Town
cty1222,"Mayor Fleck - Dark Green Suit Jacket, Corn Cob Costume",Town
mdf001,"MD Foods - White Torso (Sticker on both sides), Green Legs, White Cap",Town
twn358,"Mechanic Female with Dark Blue Cap, Dark Orange Ponytail, Medium Blue Shirt and Blue Overalls, No Back Print",Town
twn358a,"Mechanic Female with Dark Blue Cap, Dark Orange Ponytail, Medium Blue Shirt and Blue Overalls, with Back Print",Town
cty1072,"Mechanic Female, Medium Blue Shirt and Blue Overalls, Dark Orange Ponytail",Town
twn361,"Mechanic Male with Blue Hat, Dark Tan Moustache and Sideburns, Medium Blue Shirt, and Blue Overalls, No Back Print",Town
twn361a,"Mechanic Male with Blue Hat, Dark Tan Moustache and Sideburns, Medium Blue Shirt, and Blue Overalls, with Back Print",Town
cty1406,"Mechanic Male with Red Construction Helmet, Beard, Medium Blue Shirt, and Blue Overalls, with Back Print",Town
twn334,"Mechanic, Dark Green Cap, Dark Blue Legs",Town
cty1030,Mechanical Engineer - Welding Mask,Town
cty0896,"Medic, Female, Peach Lips, Closed Mouth",Town
cty0355,"Medium Blue Female Shirt with Two Buttons and Shell Pendant, Black Legs, Tan Tousled and Layered Hair",Town
twn213,"Medium Blue Female Shirt with Two Buttons and Shell Pendant, Blue Legs, Dark Brown Ponytail and Swept Sideways Fringe",Town
cty0472,"Medium Blue Female Shirt with Two Buttons and Shell Pendant, Light Bluish Gray Legs, Black Bob Cut Hair",Town
twn188,"Medium Blue Female Shirt with Two Buttons and Shell Pendant, Light Bluish Gray Legs, Dark Brown Ponytail Long French Braided",Town
twn207,"Medium Blue Female Shirt with Two Buttons and Shell Pendant, Tan Legs, Dark Brown Bob Cut Hair",Town
twn189,"Medium Blue Female Shirt with Two Buttons and Shell Pendant, Tan Legs, Dark Orange Hair Ponytail Long with Side Bangs",Town
cty0262,"Medium Blue Female Shirt with Two Buttons and Shell Pendant, Tan Legs, Dark Tan Mid-Length Tousled Hair",Town
cty0346,"Medium Blue Female Shirt with Two Buttons and Shell Pendant, White Legs, Bright Light Yellow Female Hair over Shoulder",Town
twn147,"Medium Blue Jacket with Light Purple Scarf, Black Skirt, Bright Light Yellow Female Hair over Shoulder",Town
cty0443,"Medium Blue Jacket with Light Purple Scarf, Dark Blue Legs, Dark Orange Female Hair Mid-Length",Town
cty0331,"Medium Blue Jacket with Light Purple Scarf, Dark Blue Short Legs, Dark Brown Mid-Length Tousled Hair",Town
game006,"Medium Blue Jacket, Black Legs, Black Mid-Length Female Hair",Town
twn044,"Medium Blue Jacket, Dark Blue Legs, Reddish Brown Ponytail Hair",Town
trn125,"Medium Blue Jacket, Light Bluish Gray Legs, Black Mid-Length Female Hair",Town
twn029,"Medium Blue Jacket, Orange Legs, Reddish Brown Ponytail Hair",Town
trn117,"Medium Blue Jacket, White Legs, Black Mid-Length Female Hair",Town
twn024,"Medium Blue Jacket, White Legs, Black Ponytail Hair",Town
twn040,"Medium Blue Jacket, White Legs, Dark Tan Female Hair",Town
twn031,"Medium Blue Jacket, White Legs, Reddish Brown Ponytail Hair",Town
cty0672,"Medium Blue Uniform Shirt with Pocket and Octan Logo, Dark Blue Legs, Dark Brown Smooth Hair",Town
cty0673,"Medium Blue Uniform Shirt with Pocket and Octan Logo, Medium Blue Legs, Blue Cap with Hole",Town
cty0689,"Medium Blue Uniform Shirt with Pocket and Octan Logo, Medium Blue Legs, Blue Cap with Hole, Lopsided Smile",Town
cty0679,"Medium Blue Uniform Shirt with Pocket and Octan Logo, Medium Blue Legs, Blue Short Bill Cap, Goatee",Town
cty0666,"Medium Lavender Jacket over Lavender Shirt, Medium Blue Legs, Dark Orange Female Hair Short Swept Sideways",Town
twn280,"Medium Lavender Jacket over Lavender Shirt, Medium Blue Legs, Reddish Brown Female Hair Mid-Length",Town
cty0902,"Medium Nougat Argyle Sweater, Dark Tan Legs, Black Hair, Large Round Glasses",Town
cty0849,Miner - Equipment Operator,Town
cty0875,Miner - Equipment Operator with Beard,Town
cty0895,"Miner - Equipment Operator with Beard, Reddish Brown Hair",Town
cty0877,Miner - Female Explosives Engineer,Town
cty0885,Miner - Female Explosives Engineer with Dual Sided Head,Town
cty0848,Miner - Female Scientist,Town
cty0876,Miner - Foreman,Town
cty0310,"Miner - Overalls Blue over V-Neck Shirt, Blue Legs, Mining Helmet, Crooked Smile and Scar",Town
cty0311,"Miner - Shirt with Harness and Wrench, Dark Tan Legs, Mining Helmet, Sweat Drops",Town
cty0333,"Miner - Shirt with Harness and Wrench, Sand Blue Legs, Red Short Bill Cap",Town
cty0884,"Miner - Shirt with Straps, Dark Blue Legs, Mining Helmet, Goatee and Moustache",Town
cty0846,"Miner - Shirt with Straps, Dark Blue Legs, Mining Helmet, Stubble and Scar",Town
cty0847,"Miner - Shirt with Straps, Dark Blue Legs, Mining Helmet, Sweat Drops",Town
cty0322,"Miner - Shirt with Tie and Suspenders, Mining Helmet, Beard",Town
twn416,"Mom - Bright Light Orange Jacket, Medium Lavender Legs, Dark Orange Hair",Town
cty1018,"Mom - Bright Pink Female Top, White Legs, Black Hair Coiled and Short",Town
twn234,Mom - Dark Purple and Lavender Striped Top,Town
twn301,"Mom - Green Female Jacket Open with Necklace, Dark Tan Legs, Dark Brown Hair Female Large High Bun",Town
twn299,"Mom - Medium Lavender Jacket over Lavender Shirt, Dark Purple Legs, Dark Orange Female Hair Short Swept Sideways",Town
cty1234,"Mom - Medium Lavender Jacket, Dark Blue Legs, Black Hair",Town
cty1216,"Mom - Medium Lavender Jacket, Medium Nougat Legs, Orange Hair",Town
twn249,"Mom, Bright Pink Top with Butterflies and Flowers, Lime Legs",Town
twn290,"Mom, Medium Lavender Jacket over Lavender Shirt, Dark Tan Legs, Black Hair",Town
twn239,"Mom, Pink Striped Top",Town
cty0856,Monster Truck Driver,Town
cty1107,"Monster Truck Driver, Lime Legs and Jacket with Purple Flames and Arms, White Helmet",Town
cty0385,"Monster Truck Driver, Race Suit with Airborne Spoilers Logo, Black Helmet with Trans-Black Visor, Crooked Smile",Town
cty0475,"Monster Truck Driver, Race Suit with Black and White Swirls, Black Helmet with Trans-Black Visor, Crooked Smile",Town
cty0386,"Monster Truck Mechanic, Race Suit with Airborne Spoilers Logo, Red Cap with Hole, Headphones, Black and Silver Sunglasses",Town
cty0387,"Monster Truck Mechanic, Race Suit with Airborne Spoilers Logo, Red Cap with Hole, Safety Goggles",Town
cty1347,"Mother, Bright Light Blue Hospital Gown, Tan Hair",Town
cty1419,"Motorcycle Driver - Red Helmet, Black Legs, Red Arms",Town
cty0614,Motorcyclist - Ambulance Plane Passenger,Town
cty1097,"Motorcyclist, Stunt Driver",Town
cty0836,Mountain Police - Armored Truck Driver,Town
cty0851,Mountain Police - Crook Female Jacket over 87 Prison Stripes,Town
cty0867,"Mountain Police - Crook Female Jacket over 87 Prison Stripes, Backpack",Town
cty0850,"Mountain Police - Crook Male Bare Chest, White Underwear with Red Pawprints Pattern",Town
cty0872,Mountain Police - Crook Male Stumpy 10K (in tree costume),Town
cty0879,"Mountain Police - Crook Male with Lined Jacket over Prisoner Shirt, Aviator Cap with Goggles",Town
cty0834,"Mountain Police - Crook Male with Lined Jacket over Prisoner Shirt, Red Cap",Town
cty0831,"Mountain Police - Crook Male with Red Fringed Shirt with Strap and Pouch, Red Cap",Town
cty0835,"Mountain Police - Crook Male with Red Fringed Shirt with Strap and Pouch, Skunk Fighter",Town
cty0871,"Mountain Police - Jail Prisoner 50380 Prison Stripes, Black Hair, Beard",Town
cty0890a,"Mountain Police - Jail Prisoner 86753 Prison Stripes, Aviator Helmet, Backpack",Town
cty0890,"Mountain Police - Jail Prisoner 86753 Prison Stripes, Aviator Helmet, Backpack with Money",Town
cty0833,"Mountain Police - Jail Prisoner 86753 Prison Stripes, Black Tousled Hair",Town
cty0869,"Mountain Police - Officer Female, Dark Blue Hat with Dark Orange Hair",Town
cty0854,"Mountain Police - Officer Female, Dirt Bike",Town
cty0852,"Mountain Police - Officer Female, Helicopter Pilot",Town
cty0832,"Mountain Police - Officer Female, Pilot with Helmet and Visor",Town
cty0855,Mountain Police - Officer Male,Town
cty0887,"Mountain Police - Officer Male, Beard, Dark Blue Cap, Sand Blue Jacket",Town
cty0883,"Mountain Police - Officer Male, Dark Blue Cap, Sand Blue Jacket",Town
cty0830,"Mountain Police - Officer Male, Dirt Bike",Town
cty0853,"Mountain Police - Officer Male, Jacket with Harness",Town
cty0946,"Mountain Police - Officer Male, Jacket with Harness, Dark Tan Hat",Town
cty1091,"Mountain Police - Officer Male, Orange Sunglasses",Town
cty0837,"Mountain Police - Officer Male, Speed Boat with Life Jacket Center Buckle",Town
cty0868,"Mountain Police - Officer Male, White Helmet and Smirk",Town
cty0870,Mountain Police - Police Chief Male,Town
cty0932,Museum Caveman,Town
twn274,Music Store Assistant,Town
twn373,"NASA Apollo 11 Astronaut - Male with White Torso with NASA Logo and Lopsided Smile",Town
twn374,"NASA Apollo 11 Astronaut - Male with White Torso with NASA Logo and Thin Grin",Town
cty0921,"Nature Photographer, Female, Medium Nougat Jacket, Sand Blue Legs, Dark Brown Hair Ponytail Long French Braided",Town
cty1098,"Nature Photographer, Tree Disguise",Town
ncklc009,"Necklace Gold - Blue Legs, Black Pigtails Hair",Town
ncklc010,"Necklace Gold - Blue Legs, Red Female Hair",Town
ncklc011,"Necklace Gold - Blue Legs, Red Pigtails Hair",Town
ncklc012,"Necklace Gold - Red Legs, Black Female Hair",Town
ncklc004,"Necklace Gold - Red Legs, Black Pigtails Hair",Town
trn077,"Necklace Gold - Red Legs, Black Ponytail Hair",Town
ncklc003,"Necklace Gold - Red Legs, Red Female Hair",Town
trn006,"Necklace Gold - White Legs, Brown Female Hair",Town
ncklc002,"Necklace Gold - White Legs, Red Female Hair",Town
ncklc008,"Necklace Red - Blue Legs, Black Female Hair",Town
ncklc001,"Necklace Red - Blue Legs, Brown Female Hair",Town
ncklc007,"Necklace Red - Blue Legs, Red Female Hair",Town
ncklc013,"Necklace Red - Red Legs, Black Female Hair",Town
trn007,"Necklace Red - Red Legs, Black Pigtails Hair",Town
trn003,"Necklace Red - Red Legs, Black Ponytail Hair",Town
trn008,"Necklace Red - Red Legs, Brown Female Hair",Town
ncklc006,"Necklace Red - White Legs, Black Female Hair",Town
ncklc005,"Necklace Red - White Legs, Brown Female Hair",Town
twn402,Newsstand Operator,Town
cty1163,"Ocean Mini-Submarine Pilot  - Male, Harness, Sand Blue Legs with Pockets, Red Cap, Lopsided Grin",Town
cty1181,"Ocean Mini-Submarine Pilot - Female, Harness, Sand Blue Legs with Pockets, Black Hair",Town
cty1167,"Ocean Researcher - Female, White Jacket, Sand Blue Legs, Glasses, Medium Nougat Hair",Town
cty1168,"Ocean Submarine Pilot - Male, Harness, Sand Blue Legs with Pockets, Red Cap, Headset",Town
oct023,"Octan - Blue Oil , Blue Legs, Blue Helmet, Trans-Light Blue Visor",Town
oct060,"Octan - Blue Oil, Blue Legs, Black Cap, Smirk and Stubble Beard",Town
oct016,"Octan - Blue Oil, Blue Legs, Blue Cap",Town
oct068,"Octan - Blue Oil, Blue Legs, Blue Short Bill Cap, Silver Sunglasses",Town
oct069,"Octan - Blue Oil, Blue Legs, Dark Red Short Bill Cap, Crooked Smile",Town
oct056a,"Octan - Blue Oil, Blue Legs, Life Jacket with Center Buckle, Blue Short Bill Cap",Town
oct037a,"Octan - Blue Oil, Blue Legs, Life Jacket, Blue Helmet 4 Stars & Stripes, Trans-Light Blue Visor",Town
oct056,"Octan - Blue Oil, Blue Legs, Life Jacket, Blue Short Bill Cap",Town
oct017,"Octan - Blue Oil, Blue Legs, Red Cap",Town
oct049,"Octan - Blue Oil, Blue Legs, Red Cap, Chin Dimple",Town
oct018,"Octan - Blue Oil, Blue Legs, Red Helmet, Trans-Light Blue Visor",Town
oct055,"Octan - Blue Oil, Blue Legs, Red Short Bill Cap (Undetermined Eyebrows)",Town
oct055a,"Octan - Blue Oil, Blue Legs, Red Short Bill Cap, Black Eyebrows",Town
oct066,"Octan - Blue Oil, Blue Legs, Red Short Bill Cap, Crooked Smile",Town
oct065,"Octan - Blue Oil, Blue Legs, Red Short Bill Cap, Open Grin",Town
oct067,"Octan - Blue Oil, Blue Legs, Red Short Bill Cap, Orange Sunglasses",Town
oct055b,"Octan - Blue Oil, Blue Legs, Red Short Bill Cap, Reddish Brown Eyebrows",Town
oct064,"Octan - Blue Oil, Blue Legs, Red Short Bill Cap, Smirk and Stubble Beard",Town
oct005,"Octan - Blue Oil, Blue Legs, White Cap",Town
oct022,"Octan - Blue Oil, Blue Legs, White Helmet, Black Visor",Town
oct006,"Octan - Blue Oil, Blue Legs, White Helmet, Black Visor, Life Jacket",Town
oct021,"Octan - Blue Oil, Blue Legs, White Helmet, Trans-Light Blue Visor",Town
oct062,"Octan - Blue Oil, Dark Blue Legs, Blue Cap",Town
oct061,"Octan - Blue Oil, Dark Bluish Gray Legs, Blue Hat, Smirk and Stubble Beard",Town
oct053,"Octan - Blue Oil, Dark Bluish Gray Legs, Red Cap, Glasses",Town
oct063,"Octan - Blue Oil, Light Bluish Gray Legs, Blue Cap",Town
oct070,"Octan - Blue Oil, Red Legs, Red Curved Cap",Town
oct050,"Octan - Blue Oil, Red Legs, Red Flat Cap",Town
oct051,"Octan - Blue Oil, Red Legs, Red Helmet, Trans-Black Visor",Town
oct054,"Octan - Blue Oil, White Legs, Blue Short Bill Cap",Town
oct020,"Octan - Green Jacket with Pen, Black Legs, Red Cap",Town
oct014,"Octan - Green Jacket with Pen, Green Legs, Black Male Hair",Town
oct001,"Octan - Green Jacket with Pen, Green Legs, Red Cap",Town
oct013,"Octan - Green Jacket with Pen, Green Legs, White Cap",Town
oct008,"Octan - Green Jacket with Pen, Light Gray Legs, Brown Ponytail Hair",Town
cty0002,"Octan - Green Jacket with Pockets, Brown Eyebrows, Thin Grin",Town
cty0001,"Octan - Green Jacket with Pockets, Smirk and Stubble Beard, Life Jacket",Town
cty0373,"Octan - Jacket with Red and Green Stripe, Red Hips and Green Legs, Red Helmet, Trans-Black Visor, Silver Sunglasses, Life Jacket Center Buckle",Town
cty0374,"Octan - Jacket with Red and Green Stripe, Red Hips and Green Legs, Red Helmet, Trans-Black Visor, Smirk and Stubble Beard, Life Jacket Center Buckle",Town
oct015,"Octan - Race Team, Green Legs, White Cap",Town
oct044,"Octan - Race Team, White Legs, Green Helmet, Trans-Light Blue Visor",Town
oct024,"Octan - Race Team, White Legs, Red Cap",Town
oct043,"Octan - Race Team, White Legs, Red Helmet, Trans-Light Blue Visor",Town
oct025,"Octan - Race Team, White Legs, White Cap",Town
oct007,"Octan - Race Team, White Legs, White Red/Green Striped Helmet, Black Visor, Life Jacket",Town
oct045,"Octan - Race Team, White Legs, White Red/Green Striped Helmet, Trans-Light Blue Visor",Town
oct027,"Octan - Racing, Blue Legs, Blue Helmet 4 Stars & Stripes, Trans-Light Blue Visor",Town
oct028,"Octan - Racing, Blue Legs, White Helmet, Trans-Light Blue Visor",Town
oct033,"Octan - Racing, Green Legs, White Red/Green Striped Helmet, Trans-Light Blue Visor",Town
oct035,"Octan - Racing, Light Gray Legs, Black Male Hair",Town
oct032,"Octan - Racing, Red Legs, Black Helmet, Trans-Light Blue Visor",Town
oct039,"Octan - Racing, Red Legs, Blue Helmet 4 Stars & Stripes, Trans-Light Blue Visor",Town
oct034,"Octan - Racing, Red Legs, Red Cap",Town
oct029,"Octan - Racing, Red Legs, Red Helmet 7 White Stars, Black Visor",Town
oct026,"Octan - Racing, Red Legs, Red Helmet 7 White Stars, Trans-Light Blue Visor",Town
oct036,"Octan - Racing, Red Legs, Red Helmet 7 White Stars, Trans-Light Blue Visor, Life Jacket",Town
oct030,"Octan - Racing, Red Legs, Red Helmet, Trans-Light Blue Visor",Town
oct031,"Octan - Racing, Red Legs, White Helmet, Black Visor",Town
oct040,"Octan - Racing, Red Legs, White Helmet, Trans-Light Blue Visor",Town
oct042,"Octan - Stars, Green Legs, Red Helmet 7 White Stars, Trans-Dark Blue Visor",Town
oct041,"Octan - Stars, White Legs, Black Helmet, Trans-Light Blue Visor",Town
oct038,"Octan - Stars, White Legs, White Helmet, Trans-Dark Blue Visor",Town
oct010,"Octan - White Logo, Blue Legs, Black Female Hair",Town
oct048,"Octan - White Logo, Blue Legs, Black Mid-Length Female Hair",Town
oct052,"Octan - White Logo, Blue Legs, Blue Cap",Town
oct047,"Octan - White Logo, Blue Legs, Reddish Brown Male Hair",Town
oct002,"Octan - White Logo, Green Legs, Black Female Hair",Town
oct004,"Octan - White Logo, Green Legs, Black Male Hair",Town
oct009,"Octan - White Logo, Green Legs, Black Ponytail Hair",Town
oct012,"Octan - White Logo, Green Legs, Red Cap",Town
oct012new2,"Octan - White Logo, Green Legs, Red Cap Long Bill (Reissue)",Town
oct012new,"Octan - White Logo, Green Legs, Red Cap Short Bill (Reissue)",Town
oct003,"Octan - White Logo, Green Legs, Red Helmet, Trans-Light Blue Visor",Town
oct011,"Octan - White Logo, Red Legs, Red Helmet, Trans-Light Blue Visor",Town
oct046,"Octan - White Logo, White Legs, Black Female Hair",Town
twn278,Office Worker,Town
twn279,"Orange Halter Top with Medium Blue Trim and Flowers Pattern, Blue Legs, Bright Light Yellow Ponytail and Swept Sideways Fringe",Town
twn142,"Orange Halter Top with Medium Blue Trim and Flowers Pattern, Blue Short Legs, Black Ponytail Hair",Town
twn185,"Orange Halter Top with Medium Blue Trim and Flowers Pattern, Dark Blue Legs, Reddish Brown Ponytail and Swept Sideways Fringe",Town
twn230,"Orange Halter Top with Medium Blue Trim and Flowers Pattern, Dark Purple Legs, Reddish Brown Ponytail and Swept Sideways Fringe",Town
twn276,"Orange Halter Top with Medium Blue Trim and Flowers Pattern, Medium Blue Legs, Reddish Brown Hair Short Wavy",Town
twn098,"Orange Halter Top with Medium Blue Trim and Flowers Pattern, Red Legs, Dark Brown Hair Ponytail Long with Side Bangs",Town
twn172,"Orange Halter Top with Medium Blue Trim and Flowers Pattern, Red Legs, Reddish Brown Ponytail and Swept Sideways Fringe",Town
twn206,"Orange Halter Top with Medium Blue Trim and Flowers Pattern, Sand Green Legs, Dark Orange Hair",Town
cty0473,"Orange Jacket with Hood over Light Blue Sweater, Blue Legs, Dark Orange Short Tousled Hair, Crooked Smile with Black Dimple",Town
cty0473a,"Orange Jacket with Hood over Light Blue Sweater, Blue Legs, Dark Orange Short Tousled Hair, Crooked Smile with Brown Dimple",Town
twn305,"Orange Jacket with Hood over Light Blue Sweater, Dark Blue Legs, Tan Tousled Hair, Open Lopsided Grin",Town
twn267,"Orange Jacket with Hood over Light Blue Sweater, Dark Blue Short Legs, Dark Brown Short Tousled Hair",Town
twn212,"Orange Jacket with Hood over Light Blue Sweater, Dark Tan Legs, Black Short Tousled Hair",Town
cty0314,"Orange Jacket with Hood over Light Blue Sweater, Light Bluish Gray Legs, Reddish Brown Male Hair",Town
cty0440,"Orange Jacket with Hood over Light Blue Sweater, Light Bluish Gray Short Legs, Reddish Brown Short Tousled Hair",Town
twn022,"Orange Rock Raiders Shirt, Brown Ponytail Hair, Life Jacket",Town
cty0630,"Orange Safety Vest with Reflective Stripes, Blue Legs, Red Construction Helmet, Glasses (TV Tower Technician)",Town
cty0704,"Orange Safety Vest with Reflective Stripes, Medium Blue Legs, Orange Short Bill Cap, Goatee",Town
cty0677,"Orange Safety Vest with Reflective Stripes, Medium Blue Legs, Orange Short Bill Cap, Orange Sunglasses",Town
cty0688,"Orange Safety Vest with Reflective Stripes, Medium Blue Legs, Red Construction Helmet with Headset",Town
air050,"Orange Safety Vest with Reflective Stripes, Medium Blue Legs, Red Construction Helmet, Smirk and Stubble Beard",Town
twn346,"Orange Safety Vest with Reflective Stripes, Orange Legs, Red Construction Helmet, Glasses",Town
trn241,"Orange Vest with Safety Stripes - Blue Legs, Red Construction Helmet, Orange Sunglasses",Town
ovr020,"Overalls Black with Pocket, Black Legs, Black Cap",Town
ovr013,"Overalls Black with Pocket, Black Legs, Blue Cap",Town
ovr004,"Overalls Black with Pocket, Black Legs, Light Gray Cap",Town
ovr014,"Overalls Black with Pocket, Black Legs, Red Cap",Town
ovr007,"Overalls Black with Pocket, Black Legs, Red Construction Helmet",Town
ovr021,"Overalls Black with Pocket, Black Legs, White Construction Helmet",Town
cty0268,"Overalls Blue over V-Neck Shirt, Blue Legs, Blue Short Bill Cap, Beard and Glasses",Town
cty0269,"Overalls Blue over V-Neck Shirt, Blue Legs, Blue Short Bill Cap, Eyelashes and Smile",Town
cty1291,"Overalls Blue over V-Neck Shirt, Blue Legs, Dark Green Cap, Moustache",Town
cty1006,"Overalls Blue over V-Neck Shirt, Blue Legs, Dark Red Cap, Dark Tan Angular Beard",Town
twn153,"Overalls Blue over V-Neck Shirt, Blue Legs, Orange Short Bill Cap",Town
cty0636,"Overalls Blue over V-Neck Shirt, Blue Legs, Red Cap with Hole",Town
cty0340,"Overalls Blue over V-Neck Shirt, Blue Legs, Red Construction Helmet",Town
twn210,"Overalls Blue over V-Neck Shirt, Blue Legs, Red Construction Helmet, Beard",Town
cty0555,"Overalls Blue over V-Neck Shirt, Blue Legs, Red Construction Helmet, Crooked Smile and Scar",Town
cty0202,"Overalls Blue over V-Neck Shirt, Blue Legs, Red Short Bill Cap",Town
cty0320,"Overalls Blue over V-Neck Shirt, Blue Legs, Red Short Bill Cap, Crooked Smile",Town
cty0178,"Overalls Blue over V-Neck Shirt, Blue Legs, Red Short Bill Cap, Glasses",Town
twn216,"Overalls Blue over V-Neck Shirt, Blue Legs, Red Short Bill Cap, Grin with Teeth",Town
cty0321,"Overalls Blue over V-Neck Shirt, Blue Legs, Red Short Bill Cap, Open Mouth Smile",Town
twn138,"Overalls Blue over V-Neck Shirt, Blue Legs, White Short Bill Cap",Town
twn151,"Overalls Blue over V-Neck Shirt, Blue Short Legs, Black Male Hair",Town
ovr022,"Overalls Blue with Pocket, Blue Legs, Black Cap",Town
ovr002,"Overalls Blue with Pocket, Blue Legs, Black Construction Helmet",Town
ovr015,"Overalls Blue with Pocket, Blue Legs, Black Hat",Town
trn025,"Overalls Blue with Pocket, Blue Legs, Black Male Hair",Town
ovr028,"Overalls Blue with Pocket, Blue Legs, Black Ponytail Hair",Town
trn026,"Overalls Blue with Pocket, Blue Legs, Blue Cap",Town
ovr034,"Overalls Blue with Pocket, Blue Legs, Blue Hat",Town
ovr035,"Overalls Blue with Pocket, Blue Legs, Blue Wizard / Witch Hat",Town
ovr018,"Overalls Blue with Pocket, Blue Legs, Brown Female Hair",Town
ovr012,"Overalls Blue with Pocket, Blue Legs, Brown Male Hair",Town
ovr017,"Overalls Blue with Pocket, Blue Legs, Brown Ponytail Hair",Town
ovr016,"Overalls Blue with Pocket, Blue Legs, Green Cap",Town
ovr003,"Overalls Blue with Pocket, Blue Legs, Red Cap",Town
ovr001,"Overalls Blue with Pocket, Blue Legs, Red Construction Helmet",Town
ovr029,"Overalls Blue with Pocket, Blue Legs, Red Female Hair",Town
ovr011,"Overalls Blue with Pocket, Blue Legs, White Cap",Town
cty0176,"Overalls Farmer Green, Black Short Bill Cap",Town
cty0245,"Overalls Farmer Green, Black Short Bill Cap and Glasses",Town
cty0136,"Overalls Farmer Green, Blue Cap",Town
cty0326,"Overalls Farmer Green, Dark Bluish Gray Knit Cap",Town
cty0161,"Overalls Farmer Green, Dark Brown Short Tousled Hair",Town
cty0521,"Overalls Farmer Green, Dark Brown Short Tousled Hair, Standard Grin",Town
cty0499,"Overalls Farmer Green, Green Cap with Hole, Brown Moustache and Goatee",Town
twn055,"Overalls Farmer Green, Light Bluish Gray Hair, Glasses",Town
cty0296,"Overalls Farmer Green, Lime Short Bill Cap",Town
cty0399,"Overalls Farmer Green, Red Cap with Hole, Headphones",Town
twn106,"Overalls Farmer Green, Red Construction Helmet",Town
twn115,"Overalls Farmer Green, Red Short Bill Cap",Town
cty0170,"Overalls Farmer Green, Red Short Bill Cap, Beard and Glasses",Town
cty0058,"Overalls Farmer Green, Reddish Brown Male Hair (Undetermined Eyebrows)",Town
cty0058a,"Overalls Farmer Green, Reddish Brown Male Hair, Black Eyebrows",Town
cty0058b,"Overalls Farmer Green, Reddish Brown Male Hair, Reddish Brown Eyebrows",Town
cty0133,"Overalls Farmer Green, Tan Fedora, Beard and Glasses",Town
cty0059,"Overalls Farmer Green, Tan Ponytail Hair",Town
ovr037,"Overalls Green with Pocket, Green Legs, Blue Cap with Long Flat Bill, Smirk and Stubble Beard",Town
ovr037a,"Overalls Green with Pocket, Green Legs, Blue Cap with Short Curved Bill, Smirk and Stubble Beard",Town
ovr040,"Overalls Green with Pocket, Green Legs, Blue Cap, Thin Grin with Teeth",Town
ovr027,"Overalls Green with Pocket, Green Legs, Dark Bluish Gray Knit Cap, Beard",Town
ovr019,"Overalls Green with Pocket, Green Legs, Green Cap, Standard Grin",Town
ovr032,"Overalls Green with Pocket, Green Legs, Light Bluish Gray Male Hair",Town
ovr036,"Overalls Green with Pocket, Green Legs, Tan Fedora",Town
ovr041,"Overalls Green with Pocket, Light Bluish Gray Legs, Orange Sunglasses, Reddish Brown Hair",Town
ovr023,"Overalls Light Gray with Pocket, Light Gray Legs, White Cap - Glued",Town
ovr010,"Overalls Red with Pocket, Red Legs, Black Male Hair",Town
ovr009,"Overalls Red with Pocket, Red Legs, Black Pigtails Hair",Town
ovr026,"Overalls Red with Pocket, Red Legs, Black Ponytail Hair",Town
ovr008,"Overalls Red with Pocket, Red Legs, Red Cap",Town
ovr005,"Overalls Red with Pocket, Red Legs, Red Construction Helmet",Town
ovr006,"Overalls Red with Pocket, Red Legs, White Cap",Town
ovr025,"Overalls Striped Blue with Pocket, Blue Legs, Black Cap, Standard Grin",Town
ovr033,"Overalls Striped Blue with Pocket, Blue Legs, Black Female Hair",Town
ovr024,"Overalls Striped Blue with Pocket, Blue Legs, Blue Helmet, Trans-Black Visor",Town
ovr031,"Overalls Striped Blue with Pocket, Blue Legs, Red Construction Helmet, Cheek Lines, Dark Bluish Gray Hands",Town
ovr030,"Overalls Striped Blue with Pocket, Blue Legs, Red Construction Helmet, Silver Glasses and Eyebrows",Town
ovr038,"Overalls Striped Blue with Pocket, Blue Legs, Red Short Bill Cap, Beard Around Mouth",Town
con005,"Overalls with Safety Stripe Blue, Brown Cavalry Cap",Town
con002,"Overalls with Safety Stripe Blue, White Construction Helmet",Town
twn123a,"Overalls with Safety Stripe Orange, Black Legs, Dark Bluish Gray Knit Cap, Black Legs, Black Eyebrows, Thin Grin",Town
twn123,"Overalls with Safety Stripe Orange, Black Legs, Dark Bluish Gray Knit Cap, Brown Eyebrows, Thin Grin",Town
cty0042,"Overalls with Safety Stripe Orange, Blue Legs, Blue Cap, Smirk and Stubble Beard",Town
cty0238,"Overalls with Safety Stripe Orange, Orange Legs and Dark Bluish Gray Hips, Black Knit Cap",Town
air033,"Overalls with Safety Stripe Orange, Orange Legs, Black Cap, Smirk and Stubble Beard",Town
cty0427,"Overalls with Safety Stripe Orange, Orange Legs, Black Knit Cap (Dock Worker)",Town
