image,item_number,description,culture_represented,set_id,set_description,category,gender,year,inspiration,link,release_year,region
NA,adv001,Achu,South American,1492383,Amazon Ancient Ruins,Adventurers: Jungle,male,1999,NA,https://www.bricklink.com/v2/catalog/catalogitem.page?S=5986-1#T=S&O={%22iconly%22:0},1999,South American
NA,adv008,Gabarros,South American,1492383,Amazon Ancient Ruins,Adventurers: Jungle,male,1999,NA,https://www.bricklink.com/v2/catalog/catalogitem.page?M=adv008#T=S&O={%22iconly%22:0},1999,South American
NA,hol139,"Daughter, Chinese New Year's Eve Dinner",Chinese,80101-1,Chinese New Year's Eve Dinner,Holiday & Event: Chinese New Year,female,2019,NA,https://www.bricklink.com/v2/catalog/catalogitem.page?M=hol139#T=S&O={%22iconly%22:0},2019,East Asian
NA,hol142,"Father, Chinese New Year's Eve Dinner",Chinese,80101-1,Chinese New Year's Eve Dinner,Holiday & Event: Chinese New Year,male,2019,NA,https://www.bricklink.com/v2/catalog/catalogitem.page?M=hol142#T=S&O={%22iconly%22:0},2019,East Asian
NA,hol140,"Grandfather, Chinese New Year's Eve Dinner",Chinese,80101-1,Chinese New Year's Eve Dinner,Holiday & Event: Chinese New Year,male,2019,NA,https://www.bricklink.com/v2/catalog/catalogitem.page?M=hol140#T=S&O={%22iconly%22:0},2019,East Asian
NA,hol141,"Grandmother, Chinese New Year's Eve Dinner",Chinese,80101-1,Chinese New Year's Eve Dinner,Holiday & Event: Chinese New Year,female,2019,NA,https://www.bricklink.com/v2/catalog/catalogitem.page?M=hol141#T=S&O={%22iconly%22:0},2019,East Asian
NA,hol138,"Mother, Chinese New Year's Eve Dinner",Chinese,80101-1,Chinese New Year's Eve Dinner,Holiday & Event: Chinese New Year,female,2019,NA,https://www.bricklink.com/v2/catalog/catalogitem.page?M=hol138#T=S&O={%22iconly%22:0},2019,East Asian
NA,hol143,"Son, Chinese New Year's Eve Dinner",Chinese,80101-1,Chinese New Year's Eve Dinner,Holiday & Event: Chinese New Year,male,2019,NA,https://www.bricklink.com/v2/catalog/catalogitem.page?M=hol143#T=S&O={%22iconly%22:0},2019,East Asian
NA,adv023,Señor Palomar (Senor Palomar),South American,1492383,Amazon Ancient Ruins,Adventurers: Jungle,male,1999,NA,https://www.bricklink.com/v2/catalog/catalogitem.page?M=adv023#T=S&O={%22iconly%22:0},1999,South American
NA,adv027,Babloo,South Asian,2013949,Elephant Caravan,Adventurers: Orient Expedition,male,2003,NA,https://www.bricklink.com/v2/catalog/catalogitem.page?M=adv027#T=S&O={%22iconly%22:0},2003,South Asian
NA,adv046,Dragon Fortress Guard - Conical Helmet,Chinese,"7419-1, 7416-1","Dragon Fortress, Emperor's Ship",Adventurers: Orient Expedition,male,2003,NA,https://www.bricklink.com/v2/catalog/catalogitem.page?M=adv046#T=S&O={%22iconly%22:0},2003,East Asian
NA,hol189,"Child Girl, Black Hair, Red Scarf, Dark Pink Puffy Jacket, White Shirt, Medium Blue Short Legs",Chinese,80105-1,Chinese New Year Temple Fair,Holiday & Event: Chinese New Year,female,2020,NA,https://www.bricklink.com/v2/catalog/catalogitem.page?M=hol189#T=S&O={%22iconly%22:0},2020,East Asian
NA,hol183,"Food Vendor, Red Cap and Apron, Bright Light Orange Chinese Logogram '烧烤' (Barbecue)",Chinese,80105-1,Chinese New Year Temple Fair,Holiday & Event: Chinese New Year,male,2020,NA,https://www.bricklink.com/v2/catalog/catalogitem.page?M=hol183#T=S&O={%22iconly%22:0},2020,East Asian
NA,hol187,"Man, Dark Red Jacket with Bright Light Blue Shirt, Dark Tan Legs, Red Scarf, Black Smooth Hair, Glasses",Chinese,80105-1,Chinese New Year Temple Fair,Holiday & Event: Chinese New Year,male,2020,NA,https://www.bricklink.com/v2/catalog/catalogitem.page?M=hol187#T=S&O={%22iconly%22:0},2020,East Asian
NA,hol192,"Porcelain Vendor, Female, Light Bluish Gray Hair, Glasses, Sand Blue Tunic, Medium Nougat Sash, Tan Legs",Chinese,80105-1,Chinese New Year Temple Fair,Holiday & Event: Chinese New Year,female,2020,NA,https://www.bricklink.com/v2/catalog/catalogitem.page?M=hol192#T=S&O={%22iconly%22:0},2020,East Asian
NA,hol195,"Shadow Puppeteer, Light Bluish Gray Hair, Glasses, Blue Changshan with Yellow Hem and Sash, Silver Circles Pattern",Chinese,80105-1,Chinese New Year Temple Fair,Holiday & Event: Chinese New Year,male,2020,NA,https://www.bricklink.com/v2/catalog/catalogitem.page?M=hol195#T=S&O={%22iconly%22:0},2020,East Asian
NA,hol186,"Toy Vendor, Black Hair, Red Changshan with Bright Light Orange Wide Hem, Gold Circles Pattern",Chinese,80105-1,Chinese New Year Temple Fair,Holiday & Event: Chinese New Year,male,2020,NA,https://www.bricklink.com/v2/catalog/catalogitem.page?M=hol186#T=S&O={%22iconly%22:0},2020,East Asian
NA,adv047,"Dragon Fortress Guard - Conical Helmet, Quiver",Chinese,2014679,Emperor's Ship,Adventurers: Orient Expedition,male,2003,NA,https://www.bricklink.com/v2/catalog/catalogitem.page?M=adv047#T=S&O={%22iconly%22:0},2003,East Asian
NA,adv048,Emperor Chang Wu with Cape,Chinese,2015775,Dragon Fortress,Adventurers: Orient Expedition,male,2003,NA,https://www.bricklink.com/v2/catalog/catalogitem.page?M=adv048#T=S&O={%22iconly%22:0},2003,East Asian
NA,adv050,Jing Lee the Wanderer,Chinese,"7419-1, 3382-1","Dragon Fortress, Jing Lee the Wanderer, Chupa Chups Promotional polybag",Adventurers: Orient Expedition,female,2003,NA,https://www.bricklink.com/v2/catalog/catalogitem.page?M=adv050#T=S&O={%22iconly%22:0},2003,East Asian
NA,adv030,Maharaja Lallu,South Asian,2015410,Scorpion Palace,Adventurers: Orient Expedition,male,2003,NA,https://www.bricklink.com/v2/catalog/catalogitem.page?M=adv030#T=S&O={%22iconly%22:0},2003,South Asian
NA,adv032,Ngan Pa (Yeti Hunter),Mongolian,2015045,Temple of Mount Everest,Adventurers: Orient Expedition,male,2003,NA,https://www.bricklink.com/v2/catalog/catalogitem.page?M=adv032#T=S&O={%22iconly%22:0},2003,East Asian
NA,hol264,"Grandfather, Black Shirt with Dark Red Scarf, Dark Brown Legs, Light Bluish Gray Hair",Chinese,80108-1,Lunar New Year Traditions,Holiday & Event: Chinese New Year,male,2022,NA,https://www.bricklink.com/v2/catalog/catalogitem.page?M=hol264#T=S&O={%22iconly%22:0},2022,East Asian
NA,hol268,The God of Wealth,Chinese,80108-1,Lunar New Year Traditions,Holiday & Event: Chinese New Year,male,2022,NA,https://www.bricklink.com/v2/catalog/catalogitem.page?M=hol268#T=S&O={%22iconly%22:0},2022,East Asian
NA,adv021,Pharaoh Hotep,Egyptian,"2996-1, 3021-1, 1183-1, 5958-1, 5988-1, 5978-1","Adventurers Tomb (The Lost Tomb), King Pharaoh the Third, Mummy and Cart, Mummy's Tomb, Pharaoh's Forbidden Ruins, Sphinx Secret Surprise",Adventurers: Desert,male,1998 - 2001,NA,https://www.bricklink.com/v2/catalog/catalogitem.page?M=adv021#T=S&O={%22iconly%22:0},1998,Middle Eastern
NA,hol258,Year of the Tiger Guy,Chinese,80109-1,Lunar New Year Ice Festival,Holiday & Event: Chinese New Year,neutral,2022,NA,https://www.bricklink.com/v2/catalog/catalogitem.page?M=hol258#T=S&O={%22iconly%22:0},2022,East Asian
NA,adv031,Scorpion Palace Guard,South Asian,2015410,Scorpion Palace,Adventurers: Orient Expedition,male,2003,NA,https://www.bricklink.com/v2/catalog/catalogitem.page?M=adv031#T=S&O={%22iconly%22:0},2003,South Asian
NA,adv053,Snake Charmer (Undetermined Eyebrows),South Asian,2720694,Fairytale & Historic Minifigure Set,Adventurers,male,NA,NA,https://www.bricklink.com/v2/catalog/catalogitem.page?M=adv053#T=S&O={%22iconly%22:0},NA,South Asian
NA,adv053a,"Snake Charmer, Black Eyebrows",South Asian,2720694,Fairytale & Historic Minifigure Set,Adventurers,male,2011 - 2016,NA,https://www.bricklink.com/v2/catalog/catalogitem.page?M=adv053a#T=S&O={%22iconly%22:0},2011,South Asian
NA,adv053b,"Snake Charmer, Reddish Brown Eyebrows",South Asian,2720694,Fairytale & Historic Minifigure Set,Adventurers,male,2011 - 2016,NA,https://www.bricklink.com/v2/catalog/catalogitem.page?M=adv053b#T=S&O={%22iconly%22:0},2011,South Asian
NA,hol137,"Dragon Dance Performer, Pig Costume, No Tail, Open Mouth Smile with White Teeth and Red Tongue",Chinese,80102-1,Dragon Dance,Holiday & Event: Chinese New Year,male,2019,NA,https://www.bricklink.com/v2/catalog/catalogitem.page?M=hol137#T=S&O={%22iconly%22:0},2019,East Asian
NA,hol136,"Dragon Dance Performer, Tied Red Bandana, Angry Eyebrows and Scowl",Chinese,80102-1,Dragon Dance,Holiday & Event: Chinese New Year,male,2019,NA,https://www.bricklink.com/v2/catalog/catalogitem.page?M=hol136#T=S&O={%22iconly%22:0},2019,East Asian
NA,hol134,"Dragon Dance Performer, Tied Red Bandana, Open Mouth Smile with Teeth",Chinese,80102-1,Dragon Dance,Holiday & Event: Chinese New Year,male,2019,NA,https://www.bricklink.com/v2/catalog/catalogitem.page?M=hol134#T=S&O={%22iconly%22:0},2019,East Asian
NA,hol133,"Dragon Dance Performer, Top Knot and Headband, Lopsided Grin",Chinese,80102-1,Dragon Dance,Holiday & Event: Chinese New Year,male,2019,NA,https://www.bricklink.com/v2/catalog/catalogitem.page?M=hol133#T=S&O={%22iconly%22:0},2019,East Asian
NA,hol135,"Dragon Dance Performer, Top Knot and Headband, Scared / Lopsided Smile",Chinese,80102-1,Dragon Dance,Holiday & Event: Chinese New Year,male,2019,NA,https://www.bricklink.com/v2/catalog/catalogitem.page?M=hol135#T=S&O={%22iconly%22:0},2019,East Asian
NA,iaj037,Cairo Swordsman,Egyptian,1933961,Ambush in Cairo,Indiana Jones: Raiders of the Lost Ark,male,2009,Indiana Jones,https://www.bricklink.com/v2/catalog/catalogitem.page?M=iaj037#T=S&O={%22iconly%22:0},2009,Middle Eastern
NA,hol180,"Lion Dance Musician, Red Head Wrap, Glasses, Red Robe with Gold Dragon",Chinese,80104-1,Lion Dance,Holiday & Event: Chinese New Year,male,2020,NA,https://www.bricklink.com/v2/catalog/catalogitem.page?M=hol180#T=S&O={%22iconly%22:0},2020,East Asian
NA,hol181,"Lion Dance Musician, Red Head Wrap, Lopsided Grin, Raised Eyebrow, Red Robe with Gold Dragon",Chinese,80104-1,Lion Dance,Holiday & Event: Chinese New Year,male,2020,NA,https://www.bricklink.com/v2/catalog/catalogitem.page?M=hol181#T=S&O={%22iconly%22:0},2020,East Asian
NA,hol179,"Lion Dance Musician, Red Head Wrap, Smile, Red Robe with Gold Dragon",Chinese,80104-1,Lion Dance,Holiday & Event: Chinese New Year,male,2020,NA,https://www.bricklink.com/v2/catalog/catalogitem.page?M=hol179#T=S&O={%22iconly%22:0},2020,East Asian
NA,hol178,"Man, Lion Dance, Red Shirt, Red Legs with Gold Fringe",Chinese,80104-1,Lion Dance,Holiday & Event: Chinese New Year,male,2020,NA,https://www.bricklink.com/v2/catalog/catalogitem.page?M=hol178#T=S&O={%22iconly%22:0},2020,East Asian
NA,hol175,"Mayor, Lion Dance, Red Scarf, Black Suit",Chinese,80104-1,Lion Dance,Holiday & Event: Chinese New Year,male,2020,NA,https://www.bricklink.com/v2/catalog/catalogitem.page?M=hol175#T=S&O={%22iconly%22:0},2020,East Asian
NA,hol176,"Woman, Lion Dance, White Shirt, Gold Legs with Fringe",Chinese,80104-1,Lion Dance,Holiday & Event: Chinese New Year,female,2020,NA,https://www.bricklink.com/v2/catalog/catalogitem.page?M=hol176#T=S&O={%22iconly%22:0},2020,East Asian
NA,hol177,"Woman, Lion Dance, White Shirt, White Legs with Red Fringe",Chinese,80104-1,Lion Dance,Holiday & Event: Chinese New Year,female,2020,NA,https://www.bricklink.com/v2/catalog/catalogitem.page?M=hol177#T=S&O={%22iconly%22:0},2020,East Asian
NA,hol174,Year of the Rat Mascot Guy,Chinese,80104-1,Lion Dance,Holiday & Event: Chinese New Year,male,2020,NA,https://www.bricklink.com/v2/catalog/catalogitem.page?M=hol174#T=S&O={%22iconly%22:0},2020,East Asian
NA,iaj038,Cairo Thug,Egyptian,1933961,Ambush in Cairo,Indiana Jones: Raiders of the Lost Ark,male,2009,Indiana Jones,https://www.bricklink.com/v2/catalog/catalogitem.page?M=iaj038#T=S&O={%22iconly%22:0},2009,Middle Eastern
NA,iaj018,Colonel Dovchenko,Ukranian,"7626-1, 7628-1","Jungle Cutter, Peril in Peru",Indiana Jones: Kingdom of the Crystal Skull,male,2008,Indiana Jones,https://www.bricklink.com/v2/catalog/catalogitem.page?M=iaj018#T=S&O={%22iconly%22:0},2008,Eastern European
NA,iaj003,German Soldier 1,German,2089189,Indiana Jones Motorcycle Chase,Indiana Jones: Last Crusade,male,2008,Indiana Jones,https://www.bricklink.com/v2/catalog/catalogitem.page?M=iaj003#T=S&O={%22iconly%22:0},2008,Western European
NA,iaj005,German Soldier 2,German,2089920,Race for the Stolen Treasure,Indiana Jones: Raiders of the Lost Ark,male,2008,Indiana Jones,https://www.bricklink.com/v2/catalog/catalogitem.page?M=iaj005#T=S&O={%22iconly%22:0},2008,Western European
NA,iaj006,German Soldier 3,German,2089920,Race for the Stolen Treasure,Indiana Jones: Raiders of the Lost Ark,male,2008,Indiana Jones,https://www.bricklink.com/v2/catalog/catalogitem.page?M=iaj006#T=S&O={%22iconly%22:0},2008,Western European
NA,iaj004,German Soldier 4,German,2089920,Race for the Stolen Treasure,Indiana Jones: Raiders of the Lost Ark,male,2008,Indiana Jones,https://www.bricklink.com/v2/catalog/catalogitem.page?M=iaj004#T=S&O={%22iconly%22:0},2008,Western European
NA,iaj023,"
German Soldier 5",German,"7683-1, 7198-1","Fight on the Flying Wing, Fighter Plane Attack",Indiana Jones: Raiders of the Lost Ark,male,2009,Indiana Jones,https://www.bricklink.com/v2/catalog/catalogitem.page?M=iaj023#T=S&O={%22iconly%22:0},2009,Western European
NA,hol223,"Child Boy, Red Shirt, Black Short Legs, Dark Azure Beanie",Chinese,80106-1,Story of Nian,Holiday & Event: Chinese New Year,male,2021,NA,https://www.bricklink.com/v2/catalog/catalogitem.page?M=hol223#T=S&O={%22iconly%22:0},2021,East Asian
NA,hol222,"Child Girl, Red Shirt with Bows and Flowers, Red Short Legs, Black Short Hair, Glasses",Chinese,80106-1,Story of Nian,Holiday & Event: Chinese New Year,female,2021,NA,https://www.bricklink.com/v2/catalog/catalogitem.page?M=hol222#T=S&O={%22iconly%22:0},2021,East Asian
NA,hol225,"Father, Red Shirt, Blue Legs, Black Hair",Chinese,80106-1,Story of Nian,Holiday & Event: Chinese New Year,male,2021,NA,https://www.bricklink.com/v2/catalog/catalogitem.page?M=hol225#T=S&O={%22iconly%22:0},2021,East Asian
NA,hol221,"Grandfather, Argyle Cardigan over Red Shirt, Dark Blue Legs, Light Bluish Gray Hair",Chinese,80106-1,Story of Nian,Holiday & Event: Chinese New Year,male,2021,NA,https://www.bricklink.com/v2/catalog/catalogitem.page?M=hol221#T=S&O={%22iconly%22:0},2021,East Asian
NA,hol220,"Grandmother, Floral Shirt, Black Legs, Light Bluish Gray Hair, Glasses",Chinese,80106-1,Story of Nian,Holiday & Event: Chinese New Year,female,2021,NA,https://www.bricklink.com/v2/catalog/catalogitem.page?M=hol220#T=S&O={%22iconly%22:0},2021,East Asian
NA,hol224,Year of the Ox Guy,Chinese,80106-1,Story of Nian,Holiday & Event: Chinese New Year,male,2021,NA,https://www.bricklink.com/v2/catalog/catalogitem.page?M=hol224#T=S&O={%22iconly%22:0},2021,East Asian
NA,hol230,"Child Boy, Monkie Kid Shirt, Red Scarf, Dark Green Short Legs, Black Hair",Chinese,80107-1,Spring Lantern Festival,Holiday & Event: Chinese New Year,male,2021,NA,https://www.bricklink.com/v2/catalog/catalogitem.page?M=hol230#T=S&O={%22iconly%22:0},2021,East Asian
NA,hol228,"Man, Dark Red '2021' Shirt, Blue Legs, Black Hair",Chinese,80107-1,Spring Lantern Festival,Holiday & Event: Chinese New Year,male,2021,NA,https://www.bricklink.com/v2/catalog/catalogitem.page?M=hol228#T=S&O={%22iconly%22:0},2021,East Asian
NA,hol233,Statue - Chinese New Year Lantern Festival,Chinese,80107-1,Spring Lantern Festival,Holiday & Event: Chinese New Year,neutral,2021,NA,https://www.bricklink.com/v2/catalog/catalogitem.page?M=hol233#T=S&O={%22iconly%22:0},2021,East Asian
NA,hol229,"Woman, Dark Red '2021' Shirt, Sand Blue Legs, Long Black Hair",Chinese,80107-1,Spring Lantern Festival,Holiday & Event: Chinese New Year,female,2021,NA,https://www.bricklink.com/v2/catalog/catalogitem.page?M=hol229#T=S&O={%22iconly%22:0},2021,East Asian
NA,iaj014,Irina Spalko,Russian,"7624-1, 7628-1, 7627-1","Jungle Duel, Peril in Peru, Temple of the Crystal Skull",Indiana Jones: Kingdom of the Crystal Skull:,female,2008 - 2009,Indiana Jones,https://www.bricklink.com/v2/catalog/catalogitem.page?M=iaj014#T=S&O={%22iconly%22:0},2008,Eastern European
NA,iaj041,Kazim,Armenian,1934692,Venice Canal Chase,Indiana Jones: Last Crusade,male,2009,Indiana Jones,https://www.bricklink.com/v2/catalog/catalogitem.page?M=iaj041#T=S&O={%22iconly%22:0},2009,Eastern European
NA,iaj036,Marion Ravenwood - Red and White Cairo Outfit,Egyptian,1933961,Ambush in Cairo,Indiana Jones: Raiders of the Lost Ark,female,2009,Indiana Jones,https://www.bricklink.com/v2/catalog/catalogitem.page?M=iaj036#T=S&O={%22iconly%22:0},2009,Middle Eastern
NA,Tlr002,Tonto,Native American,"30261-1, 79107-1, 79108-1, 79109-1, 79111-1","Tonto's Campfire, Comanche Camp, Stagecoach Escape, Colby City Showdown, Constitution Train Chase",Western: Indians,male,2013,The Lone Ranger,https://www.bricklink.com/v2/catalog/catalogitem.page?M=tlr002&name=Tonto&category=%5BThe%20Lone%20Ranger%5D#T=S&O={%22iconly%22:0},2013,Native North American
NA,Tlr003,Red Knee,Native American,79107-1,Comanche Camp,Western: Indians,male,2013,The Lone Ranger,https://www.bricklink.com/v2/catalog/catalogitem.page?M=tlr003&name=Red%20Knee&category=%5BThe%20Lone%20Ranger%5D#T=S&O={%22iconly%22:0},2013,Native North American
NA,Tlr007,Chief Big Bear,Native American,79110-1,Silver Mine Shootout,Western: Indians,male,2013,The Lone Ranger,https://www.bricklink.com/v2/catalog/catalogitem.page?M=tlr007&name=Chief%20Big%20Bear&category=%5BThe%20Lone%20Ranger%5D#T=S&O={%22iconly%22:0},2013,Native North American
NA,Tlr012,Tonto- Mine Outfit,Native American,79110-1,Silver Mine Shootout,Western: Indians,male,2013,The Lone Ranger,https://www.bricklink.com/v2/catalog/catalogitem.page?M=tlr012&name=Tonto%20-%20Mine%20Outfit&category=%5BThe%20Lone%20Ranger%5D#T=S&O={%22iconly%22:0},2013,Native North American
NA,ww014,"Indian Red Shirt, Quiver",Native American,"6763-1, 6766-1, 6748-1, 6747-1","Rapid River Village (2002), Rapid River Village (1997), Boulder Cliff Canyon,  Chief’s Tepee",Western: Indians,male,1997-2002,NA,"https://www.bricklink.com/v2/catalog/catalogitem.page?M=ww014&name=Indian%20Red%20Shirt,%20Quiver&category=%5BWestern%5D%5BIndians%5D#T=S&O={%22iconly%22:0}",1997,Native North American
NA,ww016,"Indian Tan Shirt, Quiver",Native American,"6766-1, 6748-1, 6178-1, 2846-1","Rapid River Village (1997), Boulder Cliff Canyon, Raindance Ridge, Indian Kayak",Western: Indians,male,1997-2002,NA,"https://www.bricklink.com/v2/catalog/catalogitem.page?M=ww016&name=Indian%20Tan%20Shirt,%20Quiver&category=%5BWestern%5D%5BIndians%5D#T=S&O={%22iconly%22:0}",1997,Native North American
NA,Ww017,Indian Chief,Native American,"6763-1, 6766-1, 6747-1, 6709-1","Rapid River Village (2002), Rapid River Village (1997), Chief’s Tepee, Tribal Chief",Western: Indians,male,1997-2002,NA,https://www.bricklink.com/v2/catalog/catalogitem.page?M=ww017&name=Indian%20Chief&category=%5BWestern%5D%5BIndians%5D#T=S&O={%22iconly%22:0},1997,Native North American
NA,ww017a,Indian Chief with LEGO Logo on Back,Native American,N/A,N/A,Western: Indians,male,1997,NA,https://www.bricklink.com/v2/catalog/catalogitem.page?M=ww017a#T=S&O={%22iconly%22:0},1997,Native North American
NA,ww018,"Indian Female, Quiver",Native American,"6763-1, 6766-1, 6748-1, 6747-1","Rapid River Village (2002), Rapid River Village (1997), Boulder Cliff Canyon, Chief’s Tepee",Western: Indians,female,1997-2002,NA,"https://www.bricklink.com/v2/catalog/catalogitem.page?M=ww018&name=Indian%20Female,%20Quiver&category=%5BWestern%5D%5BIndians%5D#T=S&O={%22iconly%22:0}",1997,Native North American
NA,ww019,Indian Medicine Man,Native American,"6763-1, 6766-1, 6748-1, 6178-1, 2845-1","Rapid River Village (2002), Rapid River Village (1997), Boulder Cliff Canyon, Raindance Ridge, Indian Chief",Western: Indians,male,1997-2002,NA,https://www.bricklink.com/v2/catalog/catalogitem.page?M=ww019&name=Indian%20Medicine%20Man&category=%5BWestern%5D%5BIndians%5D#T=S&O={%22iconly%22:0},1997,Native North American
NA,ww022,Indian Red Shirt,Native American,1770697,Boulder Cliff Canyon,Western: Indians,male,1997-2002,NA,https://www.bricklink.com/v2/catalog/catalogitem.page?M=ww022#T=S&O={%22iconly%22:0},1997,Native North American
NA,ww023,Indian Tan Shirt 2,Native American,N/A,N/A,Western: Indians,male,2002,NA,https://www.bricklink.com/v2/catalog/catalogitem.page?M=ww023#T=S&O={%22iconly%22:0},2002,Native North American
NA,ww024,Indian Chief 2,Native American,N/A,N/A,Western: Indians,male,2002,NA,https://www.bricklink.com/v2/catalog/catalogitem.page?M=ww024#T=S&O={%22iconly%22:0},2002,Native North American
NA,ww026,Indian Tan Shirt,Native American,"6763-1, 6766-1","Rapid River Village (2002), Rapid River Village (1997)",Western: Indians,male,1997-2002,NA,https://www.bricklink.com/v2/catalog/catalogitem.page?M=ww026&name=Indian%20Tan%20Shirt&category=%5BWestern%5D%5BIndians%5D#T=S&O={%22iconly%22:0},1997,Native North American
NA,Pi066,Islander Female,Pacific Islander (loosely),1590998,Islander Catamaran,Pirates: Pirates I: Islanders,female,1994,Pacific Islander,"https://www.bricklink.com/v2/catalog/catalogitem.page?M=pi066&name=Islander,%20Female&category=%5BPirates%5D%5BPirates%20I%5D%5BIslanders%5D#T=S&O={%22iconly%22:0}",1994,Pacific Islander
NA,Pi066A,"Islander, Female with Quiver",Pacific Islander (loosely),"6278-1, 6269-1","Enchanted Island (1994), Enchanted Island (2001)",Pirates: Pirates I: Islanders,female,1994-2001,Pacific Islander,"https://www.bricklink.com/v2/catalog/catalogitem.page?M=pi066a&name=Islander,%20Female%20with%20Quiver&category=%5BPirates%5D%5BPirates%20I%5D%5BIslanders%5D#T=S&O={%22iconly%22:0}",1994,Pacific Islander
NA,Pi068,"Islander, King Kahuka",Pacific Islander (loosely),"6236-1, 6256-1, 6262-1, 6278-1 6269-1","King Kahuka, Islander Catamaran, King Kahuka’s Throne, Enchanted Island (1994), Enchanted Island (2001)",Pirates: Pirates I: Islanders,male,1994-2001,Pacific Islander,"https://www.bricklink.com/v2/catalog/catalogitem.page?M=pi068&name=Islander,%20King%20Kahuka&category=%5BPirates%5D%5BPirates%20I%5D%5BIslanders%5D#T=S&O={%22iconly%22:0}",1994,Pacific Islander
NA,Pi069,"Islander, King, with Black Hair-Piece",Pacific Islander (loosely),1593920,Forbidden Cove,Pirates: Pirates I: Islanders,male,1994,Pacific Islander,"https://www.bricklink.com/v2/catalog/catalogitem.page?M=pi069&name=Islander,%20King,%20with%20Black%20Hair-Piece&category=%5BPirates%5D%5BPirates%20I%5D%5BIslanders%5D#T=S&O={%22iconly%22:0}",1994,Pacific Islander
NA,Pi070,"Islander, Male",Pacific Islander (loosely),"6262-1, 6278-1, 6269-1","King Kahuka’s Throne, Enchanted Island (1994), Enchanted Island (2001)",Pirates: Pirates I: Islanders,male,1994-2001,Pacific Islander,"https://www.bricklink.com/v2/catalog/catalogitem.page?M=pi070&name=Islander,%20Male&category=%5BPirates%5D%5BPirates%20I%5D%5BIslanders%5D#T=S&O={%22iconly%22:0}",1994,Pacific Islander
NA,Pi079,"Islander, Male with Quiver",Pacific Islander (loosely),"6246-1, 6264-1","Crocodile Cage, Forbidden Cove",Pirates: Pirates I: Islanders,male,1994,Pacific Islander,"https://www.bricklink.com/v2/catalog/catalogitem.page?M=pi079&name=Islander,%20Male%20with%20Quiver&category=%5BPirates%5D%5BPirates%20I%5D%5BIslanders%5D#T=S&O={%22iconly%22:0}",1994,Pacific Islander
NA,iaj031,Mola Ram,South Asian,1935422,The Temple of Doom,Indiana Jones: Temple of Doom,male,2008,Indiana Jones,https://www.bricklink.com/v2/catalog/catalogitem.page?M=iaj031#T=S&O={%22iconly%22:0},2008,South Asian
NA,iaj013,Russian Guard 1,Russian,"7626-1, 7628-1, 7627-1","Jungle Cutter, Peril in Peru, Temple of the Crystal Skull",Indiana Jones: Kingdom of the Crystal Skull,male,2008,Indiana Jones,https://www.bricklink.com/v2/catalog/catalogitem.page?M=iaj013#T=S&O={%22iconly%22:0},2008,Eastern European
NA,iaj017,Russian Guard 2,Russian,"7626-1, 7625-1","Jungle Cutter, River Chase",Indiana Jones: Kingdom of the Crystal Skull,male,2008,Indiana Jones,https://www.bricklink.com/v2/catalog/catalogitem.page?M=iaj017#T=S&O={%22iconly%22:0},2008,Eastern European
NA,iaj021,Russian Guard 3,Russian,2091016,River Chase,Indiana Jones: Kingdom of the Crystal Skull,male,2008,Indiana Jones,https://www.bricklink.com/v2/catalog/catalogitem.page?M=iaj021#T=S&O={%22iconly%22:0},2008,Eastern European
NA,iaj010,Satipo,South American,2090285,Temple Escape,Indiana Jones: Raiders of the Lost Ark,male,2008,Indiana Jones,https://www.bricklink.com/v2/catalog/catalogitem.page?M=iaj010#T=S&O={%22iconly%22:0},2008,South American
NA,iaj028,Shanghai Gangster Grin,Chinese,2111835,Shanghai Chase,Indiana Jones: Temple of Doom,male,2009,Indiana Jones,https://www.bricklink.com/v2/catalog/catalogitem.page?M=iaj028#T=S&O={%22iconly%22:0},2009,East Asian
NA,iaj027,Shanghai Gangster Moustache,Chinese,2111835,Shanghai Chase,Indiana Jones: Temple of Doom,male,2009,Indiana Jones,https://www.bricklink.com/v2/catalog/catalogitem.page?M=iaj027#T=S&O={%22iconly%22:0},2009,East Asian
NA,iaj025,Short Round,Chinese,"7682-1, 7199-1","Shanghai Chase, The Temple of Doom",Indiana Jones: Temple of Doom,male,2009,Indiana Jones,https://www.bricklink.com/v2/catalog/catalogitem.page?M=iaj025#T=S&O={%22iconly%22:0},2009,East Asian
NA,iaj034,Temple Guard 1,South Asian,1935422,The Temple of Doom,Indiana Jones: Temple of Doom,male,2009,Indiana Jones,https://www.bricklink.com/v2/catalog/catalogitem.page?M=iaj034#T=S&O={%22iconly%22:0},2009,South Asian
NA,iaj035,Temple Guard 2,South Asian,1935422,The Temple of Doom,Indiana Jones: Temple of Doom,male,2009,Indiana Jones,https://www.bricklink.com/v2/catalog/catalogitem.page?M=iaj035#T=S&O={%22iconly%22:0},2009,South Asian
NA,dis004,"Aladdin, Disney, Series 1 (Minifigure Only without Stand and Accessories)",Middle Eastern and Asian,coldis-4,"Aladdin, Disney, Series 1 (Complete Set with Stand and Accessories)",Collectible Minifigures: Disney: Disney Series 1: coldis-4,male,2016,Aladdin,"https://www.bricklink.com/v2/catalog/catalogitem.page?M=dis004&name=Aladdin,%20Disney,%20Series%201%20(Minifigure%20Only%20without%20Stand%20and%20Accessories)&category=%5BCollectible%20Minifigures%5D%5BDisney%5D%5BDisney%20Series%201%5D#T=S&O={%22iconly%22:0}",2016,Middle Eastern
