image,item_number,description,culture_represented,set_id,set_description,category,gender,year,inspiration,link,release_year,region
NA,njo701,"Jay - Seabound, Scuba Gear",Japanese,"71756-1, 892181-1, 71752-1","Hydro Bounty, Jay foil pack #9, Ninja Sub Speeder",Ninjago: Seabound,male,2021,Ninjago,https://www.bricklink.com/v2/catalog/catalogitem.page?M=njo701#T=S&O={%22iconly%22:0},2021,East Asian
NA,njo548,Jay - Secrets of the Forbidden Spinjitzu,Japanese,"892064-1, 70677-1","Jay foil pack #7, Land Bounty",Ninjago: Secrets of the Forbidden Spinjitzu,male,2019-2020,Ninjago,https://www.bricklink.com/v2/catalog/catalogitem.page?M=njo548#T=S&O={%22iconly%22:0},2019,East Asian
NA,njo210,Jay - Skybound,Japanese,70602-1,Jay's Elemental Dragon,Ninjago: Skybound,male,2016,Ninjago,https://www.bricklink.com/v2/catalog/catalogitem.page?M=njo210#T=S&O={%22iconly%22:0},2016,East Asian
NA,njo248,"Jay - Skybound, Dual Sided Head",Japanese,70594-1,The Lighthouse Siege,Ninjago: Skybound,male,2016,Ninjago,https://www.bricklink.com/v2/catalog/catalogitem.page?M=njo248#T=S&O={%22iconly%22:0},2016,East Asian
NA,njo192,"Jay - Skybound, Pirate",Japanese,70605-1,Misfortune's Keep,Ninjago: Skybound,male,2016,Ninjago,https://www.bricklink.com/v2/catalog/catalogitem.page?M=njo192#T=S&O={%22iconly%22:0},2016,East Asian
NA,njo137,Jay - Sleeveless with Bandana,Japanese,"70754-1, 30292-1, 851342-1","ElectroMech, Jay NanoMech polybag, Ninja Army Building Set blister pack
",Ninjago: Tournament of Elements,male,2015,Ninjago,https://www.bricklink.com/v2/catalog/catalogitem.page?M=njo137#T=S&O={%22iconly%22:0},2015,East Asian
NA,njo389,Jay - Sons of Garmadon,Japanese,70642-1,Killow vs. Samurai X,Ninjago: Sons of Garmadon,male,2018,Ninjago,https://www.bricklink.com/v2/catalog/catalogitem.page?M=njo389#T=S&O={%22iconly%22:0},2018,East Asian
NA,njo079,"Jay - The Final Battle, Jet Pack",Japanese,70501-1,Warrior Bike,Ninjago: The Final Battle,male,2013,Ninjago,https://www.bricklink.com/v2/catalog/catalogitem.page?M=njo079#T=S&O={%22iconly%22:0},2013,East Asian
NA,njo004,Jay - The Golden Weapons,Japanese,"30082-1, 20084-1, 2259-1, 2506-1, 2257-1, 2263-1","Enemy Training polybag, Ninjago Promotional Set polybag, Skull Motorbike, Skull Truck, Spinjitzu Starter Set blister pack, Turbo Shredder",Ninjago: The Golden Weapons,male,2011-2012,Ninjago,https://www.bricklink.com/v2/catalog/catalogitem.page?M=njo004#T=S&O={%22iconly%22:0},2011,East Asian
NA,njo692,"Jay - The Island, Mask and Hair with Bandana",Japanese,892175-1,Jay foil pack #8,Ninjago: The Island,male,2021,Ninjago,https://www.bricklink.com/v2/catalog/catalogitem.page?M=njo692#T=S&O={%22iconly%22:0},2021,East Asian
NA,njo679,"Jay - The Island, Mask and Hair with Bandana, Shoulder Pad",Japanese,"71748-1, 71747-1","Catamaran Sea Battle, The Keepers' Village",Ninjago: The Island,male,2021,Ninjago,https://www.bricklink.com/v2/catalog/catalogitem.page?M=njo679#T=S&O={%22iconly%22:0},2021,East Asian
NA,njo249,"Jay - Tournament of Elements, Bandana and Scabbard",Japanese,891615-1,Jay foil pack #2,Ninjago: Tournament of Elements,male,2016,Ninjago,https://www.bricklink.com/v2/catalog/catalogitem.page?M=njo249#T=S&O={%22iconly%22:0},2016,East Asian
NA,njo655,Jay - Urban Jay,Japanese,71741-1,NINJAGO City Gardens,Ninjago: Legacy,male,2021,Ninjago,https://www.bricklink.com/v2/catalog/catalogitem.page?M=njo655#T=S&O={%22iconly%22:0},2021,East Asian
NA,njo016,Jay DX,Japanese,"2521-1, 2519-1","Lightning Dragon Battle, Skeleton Bowling",Ninjago: The Golden Weapons,male,2011,Ninjago,https://www.bricklink.com/v2/catalog/catalogitem.page?M=njo016#T=S&O={%22iconly%22:0},2011,East Asian
NA,njo536,Jay FS,Japanese,70673-1,Shuricopter,Ninjgo: Secrets of the Forbidden Spinjitzu,male,2019,Ninjago,https://www.bricklink.com/v2/catalog/catalogitem.page?M=njo536#T=S&O={%22iconly%22:0},2019,East Asian
NA,njo534,Jay FS (Spinjitzu Slam),Japanese,"891958-1, 70682-1","Jay foil pack #6, Spinjitzu Slam - Jay",Ninjago: Secrets of the Forbidden Spinjitzu,male,2019-2021,Ninjago,https://www.bricklink.com/v2/catalog/catalogitem.page?M=njo534#T=S&O={%22iconly%22:0},2019,East Asian
NA,njo486,Jay Future,Japanese,5005257-1,"Bricktober Minifigure Collection 3/4 - Ninjago (2018 Toys ""R"" Us Exclusive)",Ninjago: (Other),male,2018,Ninjago,https://www.bricklink.com/v2/catalog/catalogitem.page?M=njo486#T=S&O={%22iconly%22:0},2018,East Asian
NA,njo601,Jay Hero - Clip on Back,Japanese,"71717-1, 71721-1","Journey To The Skull Dungeons, Skull Sorcerer's Dragon",Ninjago: Master of the Mountain,male,2020,Ninjago,https://www.bricklink.com/v2/catalog/catalogitem.page?M=njo601#T=S&O={%22iconly%22:0},2020,East Asian
NA,njo043,Jay Kendo,Japanese,"9446-1, 5000030-1","Destiny's Bounty, Kendo Jay Booster Pack polybag",Ninjago,male,2012,Ninjago,https://www.bricklink.com/v2/catalog/catalogitem.page?M=njo043#T=S&O={%22iconly%22:0},2012,East Asian
NA,njo459,Jay with Armor - Hunted,Japanese,"70654-1, 70655-1, 70652-1","Dieselnaut, Dragon Pit, Stormbringer",Ninjago: Hunted,male,2018,Ninjago,https://www.bricklink.com/v2/catalog/catalogitem.page?M=njo459#T=S&O={%22iconly%22:0},2018,East Asian
NA,njo562,Okino,Japanese,71708-1,Gamer's Market,Ninjago: Prime Empire,male,2020,Ninjago,https://www.bricklink.com/v2/catalog/catalogitem.page?M=njo562#T=S&O={%22iconly%22:0},2020,East Asian
NA,njo742,Pixal / P.I.X.A.L. - Core,Japanese,71767-1,Ninja Dojo Temple,Ninjago: Core,female,2022,Ninjago,https://www.bricklink.com/v2/catalog/catalogitem.page?M=njo742#T=S&O={%22iconly%22:0},2022,East Asian
NA,njo133,Lord Garmadon - Tournament of Elements,Japanese,70750-1,Ninja DB X,Ninjago: Tournament of Elements,male,2015,Ninjago,https://www.bricklink.com/v2/catalog/catalogitem.page?M=njo133#T=S&O={%22iconly%22:0},2015,East Asian
NA,njo094,"Lord Garmadon, Sensei - Rebooted",Japanese,70725-1,Nindroid MechDragon,Ninjago: Rebooted,male,2014,Ninjago,https://www.bricklink.com/v2/catalog/catalogitem.page?M=njo094#T=S&O={%22iconly%22:0},2014,East Asian
NA,njo392,Luke Cunningham,Japanese,70638-1,Katana V11,Ninjago: Sons of Garmadon,male,2018,Ninjago,https://www.bricklink.com/v2/catalog/catalogitem.page?M=njo392#T=S&O={%22iconly%22:0},2018,East Asian
NA,njo254,Master Yang,Japanese,70590-1,Airjitzu Battle Grounds,Ninjago: Day of the Departed,male,2016,Ninjago,https://www.bricklink.com/v2/catalog/catalogitem.page?M=njo254#T=S&O={%22iconly%22:0},2016,East Asian
NA,njo259,Master Yang with Neck Bracket and Modified Tile,Japanese,70595-1,Ultra Stealth Raider,Ninjago: Day of the Departed,male,2016,Ninjago,https://www.bricklink.com/v2/catalog/catalogitem.page?M=njo259#T=S&O={%22iconly%22:0},2016,East Asian
NA,njo288,Maya,Japanese,70627-1,Dragon's Forge,Ninjago: The Hands of Time,female,2017,Ninjago,https://www.bricklink.com/v2/catalog/catalogitem.page?M=njo288#T=S&O={%22iconly%22:0},2017,East Asian
NA,njo659,Mei,Japanese,71741-1,NINJAGO City Gardens,Ninjago: Legacy,female,2021,Ninjago,https://www.bricklink.com/v2/catalog/catalogitem.page?M=njo659#T=S&O={%22iconly%22:0},2021,East Asian
NA,njo172,Misako,Japanese,70751-1,Temple of Airjitzu,Ninjago: (Other),female,2015,Ninjago,https://www.bricklink.com/v2/catalog/catalogitem.page?M=njo172#T=S&O={%22iconly%22:0},2015,East Asian
NA,njo734,Misako - Green Hoodie,Japanese,4002021-1,2021 Employee Exclusive: The Temple of Celebrations,Ninjago: (Other),female,2021,Ninjago,https://www.bricklink.com/v2/catalog/catalogitem.page?M=njo734#T=S&O={%22iconly%22:0},2021,East Asian
NA,njo665,"Misako - Legacy, Dark Orange Jacket",Japanese,71741-1,NINJAGO City Gardens,Ninjago: Legacy,female,2021,Ninjago,https://www.bricklink.com/v2/catalog/catalogitem.page?M=njo665#T=S&O={%22iconly%22:0},2021,East Asian
NA,njo483,Mohawk,Japanese,5005257-1,"Bricktober Minifigure Collection 3/4 - Ninjago (2018 Toys ""R"" Us Exclusive)",Ninjago: Sons of Garmadon,male,2018,Ninjago,https://www.bricklink.com/v2/catalog/catalogitem.page?M=njo483#T=S&O={%22iconly%22:0},2018,East Asian
NA,njo417,Neuro,Japanese,5004938-1,"Bricktober Minifigure Collection 1/4 - Ninjago (2017 Toys ""R"" Us Exclusive)",Ninjago: (Other),male,2017,Ninjago,https://www.bricklink.com/v2/catalog/catalogitem.page?M=njo417#T=S&O={%22iconly%22:0},2017,East Asian
NA,njo171,Jesper,Japanese,70751-1,Temple of Airjitzu,Ninjago: (Other),male,2015,Ninjago,https://bricklink.com/v2/catalog/catalogitem.page?M=njo171,2015,East Asian
NA,njo470,Jet Jack,Japanese,"70650-1, 70653-1","Destiny's Wing, Firstbourne",Ninjago: Hunted,female,2018,Ninjago,https://bricklink.com/v2/catalog/catalogitem.page?M=njo470,2018,East Asian
NA,njo478,Jet Jack - Claw Marks,Japanese,891840-1,Jet Jack foil pack,Ninjago: Hunted,female,2018,Ninjago,https://bricklink.com/v2/catalog/catalogitem.page?M=njo478,2018,East Asian
NA,njo161,Kai (Airjitzu) - Possession,Japanese,70739-1,Airjitzu Kai Flyer,Ninjago: Possession,male,2015,Ninjago,https://bricklink.com/v2/catalog/catalogitem.page?M=njo161,2015,East Asian
NA,njo153,Kai (Deepstone Armor) - Possession,Japanese,"70736-1, 70732-1, 70751-1","Attack of the Morro Dragon, City of Stiix, Temple of Airjitzu",Ninjago: Possession,male,2015,Ninjago,https://bricklink.com/v2/catalog/catalogitem.page?M=njo153,2015,East Asian
NA,njo261,"Kai (Deepstone Armor) - Possession, Hair",Japanese,NA,NA,Ninjago: Possession,male,2016,Ninjago,https://bricklink.com/v2/catalog/catalogitem.page?M=njo261,2016,East Asian
NA,njo148,"Kai (Deepstone Armor) - Possession, No Shoulder Armor",Japanese,70735-1,Ronin R.E.X.,Ninjago: Possession,male,2015,Ninjago,https://bricklink.com/v2/catalog/catalogitem.page?M=njo148,2015,East Asian
NA,njo452,Kai (Dragon Masters) - Hunted,Japanese,70647-1,Kai - Dragon Master,Ninjago: Possession,male,2018,Ninjago,https://bricklink.com/v2/catalog/catalogitem.page?M=njo452,2018,East Asian
NA,njo420,Kai (Golden Power),Japanese,5004938-1,"Bricktober Minifigure Collection 1/4 - Ninjago (2017 Toys ""R"" Us Exclusive)",Ninjago: (Other),male,2017,Ninjago,https://bricklink.com/v2/catalog/catalogitem.page?M=njo420,2017,East Asian
NA,njo265,Kai (Honor Robe) - Day of the Departed,Japanese,70595-1,Ultra Stealth Raider,Ninjago: Day of the Departed,male,2016,Ninjago,https://bricklink.com/v2/catalog/catalogitem.page?M=njo265,2016,East Asian
NA,njo305,"Kai (Honor Robe) - Day of the Departed, Armor",Japanese,891723-1,Kai foil pack #3,Ninjago: Day of the Departed,male,2017,Ninjago,https://bricklink.com/v2/catalog/catalogitem.page?M=njo305,2017,East Asian
NA,njo121,"Kai (Jungle Robe) - Tournament of Elements, Scabbard",Japanese,"70745-1, 70750-1","Anacondrai Crusher, Ninja DB X",Ninjago: Tournament of Elements,male,2015,Ninjago,https://bricklink.com/v2/catalog/catalogitem.page?M=njo121,2015,East Asian
NA,njo406,Kai (Spinjitzu Masters) - Sons of Garmadon,Japanese,70633-1,Kai - Spinjitzu Master,Ninjago: Sons of Garmadon: Spinjitzu Masters,male,2018,Ninjago,https://bricklink.com/v2/catalog/catalogitem.page?M=njo406,2018,East Asian
NA,njo091,Kai (Techno Robe) - Rebooted,Japanese,"70721-1, 70727-1","Kai Fighter, X-1 Ninja Charger",Ninjago: Rebooted,male,2014,Ninjago,https://bricklink.com/v2/catalog/catalogitem.page?M=njo091,2014,East Asian
NA,njo117,Kai (Tournament Robe) - Tournament of Elements,Japanese,"70756-1, 70752-1, 30293-1, 5003085-1, 851342-1","Dojo Showdown, Jungle Trap, Kai Drifter polybag, Minifigure Pack blister pack, Ninja Army Building Set blister pack",Ninjago: Tournament of Elements,male,2015,Ninjago,https://bricklink.com/v2/catalog/catalogitem.page?M=njo117,2015,East Asian
NA,njo567,Kai - Avatar Kai,Japanese,71714-1,Kai Avatar - Arcade Pod,Ninjago: Prime Empire,male,2020,Ninjago,https://bricklink.com/v2/catalog/catalogitem.page?M=njo567,2020,East Asian
NA,njo745,Kai - Core,Japanese,112217-1,Kai vs. Boa Destructor blister pack,Ninjago: Core,male,2022,Ninjago,https://bricklink.com/v2/catalog/catalogitem.page?M=njo745,2022,East Asian
NA,njo747,Kai - Core Spinjitzu,Japanese,70688-1,Kai's Spinjitzu Ninja Training,Ninjago: Core,male,2022,Ninjago,https://bricklink.com/v2/catalog/catalogitem.page?M=njo747,2022,East Asian
NA,njo736,"Kai - Core, Hair",Japanese,71762-1,Kai’s Fire Dragon EVO,Ninjago: Core,male,2022,Ninjago,https://bricklink.com/v2/catalog/catalogitem.page?M=njo736,2022,East Asian
NA,njo739,"Kai - Core, Hair, Shoulder Pad",Japanese,71767-1,Ninja Dojo Temple,Ninjago: Core,male,2022,Ninjago,https://bricklink.com/v2/catalog/catalogitem.page?M=njo739,2022,East Asian
NA,njo721,"Kai - Core, Shoulder Pad",Japanese,71765-1,Ninja Ultra Combo Mech,Ninjago: Core,male,2022,Ninjago,https://bricklink.com/v2/catalog/catalogitem.page?M=njo721,2022,East Asian
NA,njo628,Kai - Digi Kai,Japanese,892067-1,Digi Kai foil pack,Ninjago: Prime Empire,male,2020,Ninjago,https://bricklink.com/v2/catalog/catalogitem.page?M=njo628,2020,East Asian
NA,njo568,"Kai - Digi Kai, Armor Shoulder",Japanese,"71713-1, 71714-1, 71707-1, 71710-1","Empire Dragon, Kai Avatar - Arcade Pod, Kai's Mech Jet, Ninja Tuner Car",Ninjago: Prime Empire,male,2020,Ninjago,https://bricklink.com/v2/catalog/catalogitem.page?M=njo568,2020,East Asian
NA,njo274,Kai - Hands of Time,Japanese,70621-1,The Vermillion Attack,Ninjago: The Hands of Time,male,2017,Ninjago,https://bricklink.com/v2/catalog/catalogitem.page?M=njo274,2017,East Asian
NA,njo277,"Kai - Hands of Time, Black Armor, Dual Sided Head",Japanese,"70627-1, 891729-1","Dragon's Forge, Kai foil pack #4",Ninjago: The Hands of Time,male,2017,Ninjago,https://bricklink.com/v2/catalog/catalogitem.page?M=njo277,2017,East Asian
NA,njo457,"Kai - Hunted, Flat Silver Side-Scabbard",Japanese,70655-1,Dragon Pit,Ninjago: Hunted,male,2018,Ninjago,https://bricklink.com/v2/catalog/catalogitem.page?M=njo457,2018,East Asian
NA,njo469,"Kai - Hunted, No Side-Scabbard",Japanese,70650-1,Destiny's Wing,Ninjago: Hunted,male,2018,Ninjago,https://bricklink.com/v2/catalog/catalogitem.page?M=njo469,2018,East Asian
NA,njo473,"Kai - Hunted, Pearl Dark Gray Side-Scabbard",Japanese,70653-1,Firstbourne,Ninjago: Hunted,male,2018,Ninjago,https://bricklink.com/v2/catalog/catalogitem.page?M=njo473,2018,East Asian
NA,njo492,Kai - Legacy,Japanese,"70669-1, 71749-1, 112008-1, 112113-1, 111903-1, 111903-2, 70667-1, 71701-1, 71734-1, 70670-1, 70680-1, 70659-1, 71703-1","Cole's Earth Driller, Final Flight of Destiny's Bounty, Kai vs. Lasha blister pack, Kai vs. Nindroid blister pack, Kai vs. Wyplash blister pack, Kai vs. Wyplash foil pack, Kai's Blade Cycle & Zane's Snowmobile, Kai's Fire Dragon, Kai's Blade Cycle, Monastery of Spinjitzu, Monastery Training, Spinjitzu Kai, Storm Fighter Battle",Ninjago: Legacy,male,2019,Ninjago,https://bricklink.com/v2/catalog/catalogitem.page?M=njo492,2019,East Asian
NA,njo613,"Kai - Legacy, Pearl Gold Armor Shoulder Pad",Japanese,"71705-1, 71753-1, 71741-1, 71739-1","Destiny's Bounty, Fire Dragon Attack, NINJAGO City Gardens, Ultra Sonic Raider",Ninjago: Legacy,male,2020,Ninjago,https://bricklink.com/v2/catalog/catalogitem.page?M=njo613,2020,East Asian
NA,njo650,"Kai - Legacy, Pearl Gold Robe",Japanese,"4002021-1, 71736-1","2021 Employee Exclusive: The Temple of Celebrations, Boulder Blaster",Ninjago: Legacy,male,2021,Ninjago,https://bricklink.com/v2/catalog/catalogitem.page?M=njo650,2021,East Asian
NA,njo630,"Kai - Legacy, Rebooted Robe",Japanese,"71704-1, 71735-1, 71737-1","Kai Fighter, Tournament of Elements, X-1 Ninja Charger",Ninjago: Legacy,male,2020,Ninjago,https://bricklink.com/v2/catalog/catalogitem.page?M=njo630,2020,East Asian
NA,njo513,"Kai - Legacy, Sons of Garmadon Robe",Japanese,"30535-1, 891955-1","Fire Flight polybag, Kai foil pack #6",Ninjago: Legacy,male,2019,Ninjago,https://bricklink.com/v2/catalog/catalogitem.page?M=njo513,2019,East Asian
NA,njo643,"Kai - Legacy, White Shirt",Japanese,71730-1,Epic Battle Set - Kai vs Skulkin,Ninjago: Legacy,male,2021,Ninjago,https://bricklink.com/v2/catalog/catalogitem.page?M=njo643,2021,East Asian
NA,njo119,Kai - Rebooted with Armor,Japanese,891501-1,Kai foil pack #1,Ninjago: Rebooted,male,2015,Ninjago,https://bricklink.com/v2/catalog/catalogitem.page?M=njo119,2015,East Asian
NA,njo186,Kai - Rebooted with Stone Armor,Japanese,5004077-1,Minifigure Gift Set (Target Exclusive 2015),Ninjago,male,2015,Ninjago,https://bricklink.com/v2/catalog/catalogitem.page?M=njo186,2015,East Asian
NA,njo205,Kai - Rebooted with ZX Hood,Japanese,10722-1,Snake Showdown,Ninjago,male,2016,Ninjago,https://bricklink.com/v2/catalog/catalogitem.page?M=njo205,2016,East Asian
NA,njo695,"Kai - Seabound, Scuba Gear",Japanese,"71756-1, 892184-1, 71755-1","Hydro Bounty, Scuba Kai foil pack, Temple of the Endless Sea",Ninjago: Seabound,male,2021,Ninjago,https://bricklink.com/v2/catalog/catalogitem.page?M=njo695,2021,East Asian
NA,njo531,Kai - Secrets of the Forbidden Spinjitzu,Japanese,"70672-1, 70675-1, 70677-1","Cole's Dirt Bike, Katana 4x4, Land Bounty",Ninjago: Secrets of the Forbidden Spinjitzu,male,2019,Ninjago,https://bricklink.com/v2/catalog/catalogitem.page?M=njo531,2019,East Asian
NA,njo526,"Kai - Secrets of the Forbidden Spinjitzu, Legacy Robe",Japanese,40342-1,Ninjago 2019 Minifigure Set blister pack,Ninjago: Secrets of the Forbidden Spinjitzu,male,2019,Ninjago,https://bricklink.com/v2/catalog/catalogitem.page?M=njo526,2019,East Asian
NA,njo198,Kai - Skybound,Japanese,"30422-1, 70600-1","Kai's Mini Dragon polybag, Ninja Bike Chase",Ninjago: Skybound,male,2016,Ninjago,https://bricklink.com/v2/catalog/catalogitem.page?M=njo198,2016,East Asian
NA,njo194,Kai - Skybound with Gold Scabbard,Japanese,"70591-1, 70605-1","Kryptarium Prison Breakout, Misfortune's Keep",Ninjago: Skybound,male,2016,Ninjago,https://bricklink.com/v2/catalog/catalogitem.page?M=njo194,2016,East Asian
NA,njo391,Kai - Sons of Garmadon,Japanese,70638-1,Katana V11,Ninjago: Sons of Garmadon,male,2018,Ninjago,https://bricklink.com/v2/catalog/catalogitem.page?M=njo391,2018,East Asian
NA,njo391a,Kai - Sons of Garmadon (without Asian Symbol on Wrap),Japanese,891842-1,Kai foil pack #5,Ninjago: Sons of Garmadon,male,2018,Ninjago,https://bricklink.com/v2/catalog/catalogitem.page?M=njo391a,2018,East Asian
NA,njo620,Kai - Spinjitzu Burst,Japanese,70686-1,Spinjitzu Burst Kai,Ninjago: Master of the Mountain,male,2020,Ninjago,https://bricklink.com/v2/catalog/catalogitem.page?M=njo620,2020,East Asian
NA,njo071,Kai - The Final Battle,Japanese,70500-1,Kai's Fire Mech,Ninjago: The Final Battle,male,2013,Ninjago,https://bricklink.com/v2/catalog/catalogitem.page?M=njo071,2013,East Asian
NA,njo007,Kai - The Golden Weapons,Japanese,"2508-1, 30083-1, 2505-1, 2111-1, 2258-1","Blacksmith Shop, Dragon Fight polybag, Garmadon's Dark Fortress, Kai blister pack, Ninja Ambush",Ninjago: The Golden Weapons,male,2011,Ninjago,https://bricklink.com/v2/catalog/catalogitem.page?M=njo007,2011,East Asian
NA,njo680,"Kai - The Island, Mask and Hair with Bandana",Japanese,"71748-1, 71747-1","Catamaran Sea Battle, The Keepers' Village",Ninjago: The Island,male,2021,Ninjago,https://bricklink.com/v2/catalog/catalogitem.page?M=njo680,2021,East Asian
NA,njo706,"Kai - The Island, Mask, Hair with Bandana, Neck Bracket",Japanese,892177-1,Kai foil pack #8,Ninjago: The Island,male,2021,Ninjago,https://bricklink.com/v2/catalog/catalogitem.page?M=njo706,2021,East Asian
NA,njo187,"Kai - Tournament of Elements, Scabbard, Tousled Hair",Japanese,891609-1,Kai foil pack #2,Ninjago: Tournament of Elements,male,2016,Ninjago,https://bricklink.com/v2/catalog/catalogitem.page?M=njo187,2016,East Asian
NA,njo346,Kai - White Wu-Cru Training Gi,Japanese,"5004916-1, 853702-1","Kai's Dojo Pod polybag, Movie Maker Set (Ninjago)",Ninjago: (Other),male,2017,Ninjago,https://bricklink.com/v2/catalog/catalogitem.page?M=njo346,2017,East Asian
NA,njo009,Kai DX,Japanese,"2507-1, 2254-1, 2518-1","Fire Temple, Mountain Shrine, Nuckal's ATV",Ninjago: The Golden Weapons,male,2011,Ninjago,https://bricklink.com/v2/catalog/catalogitem.page?M=njo009,2011,East Asian
NA,njo538,Kai FS,Japanese,70674-1,Fire Fang,Ninjago: Secrets of the Forbidden Spinjitzu,male,2019,Ninjago,https://bricklink.com/v2/catalog/catalogitem.page?M=njo538,2019,East Asian
NA,njo530,Kai FS (Spinjitzu Slam),Japanese,"892059-1, 70684-1","Kai foil pack #7, Spinjitzu Slam - Kai vs. Samurai",Ninjago: Secrets of the Forbidden Spinjitzu,male,2019,Ninjago,https://bricklink.com/v2/catalog/catalogitem.page?M=njo530,2019,East Asian
NA,njo605,Kai Hero - Clip on Back,Japanese,"71720-1, 71721-1","Fire Stone Mech, Skull Sorcerer's Dragon",Ninjago: Master of the Mountain,male,2020,Ninjago,https://bricklink.com/v2/catalog/catalogitem.page?M=njo605,2020,East Asian
NA,njo052,Kai Kendo,Japanese,"9456-1, 9558-1","Spinner Battle, Training Set",Ninjago: Rise of the Snakes,male,2012,Ninjago,https://bricklink.com/v2/catalog/catalogitem.page?M=njo052,2012,East Asian
NA,njo055,Kai NRG,Japanese,9591-1,Weapon Pack,Ninjago,male,2012,Ninjago,https://bricklink.com/v2/catalog/catalogitem.page?M=njo055,2012,East Asian
NA,njo037,Kai ZX - Ninja Rocket Pack,Japanese,9443-1,Rattlecopter,Ninjago,male,2012,Ninjago,https://bricklink.com/v2/catalog/catalogitem.page?M=njo037,2012,East Asian
NA,njo032,Kai ZX - Shoulder Armor,Japanese,"9561-1, 9441-1, 9449-1","Kai ZX, Kai's Blade Cycle, Ultra Sonic Raider",Ninjago,male,2012,Ninjago,https://bricklink.com/v2/catalog/catalogitem.page?M=njo032,2012,East Asian
NA,njo660,Kaito,Japanese,71741-1,NINJAGO City Gardens,Ninjago: Legacy,male,2021,Ninjago,https://bricklink.com/v2/catalog/catalogitem.page?M=njo660,2021,East Asian
NA,njo122,Kapau,Japanese,"70755-1, 70750-1","Jungle Raider, Ninja DB X",Ninjago: Tournament of Elements,male,2015,Ninjago,https://bricklink.com/v2/catalog/catalogitem.page?M=njo122,2015,East Asian
NA,njo127,Kapau'rai,Japanese,70749-1,Enter the Serpent,Ninjago: Tournament of Elements,male,2015,Ninjago,https://bricklink.com/v2/catalog/catalogitem.page?M=njo127,2015,East Asian
NA,njo118a,Karlof,Japanese,70756-1,Dojo Showdown,Ninjago: Tournament of Elements,male,2015,Ninjago,https://bricklink.com/v2/catalog/catalogitem.page?M=njo118a,2015,East Asian
NA,njo118,Karlof (without Gorilla Fists),Japanese,70756-1,Dojo Showdown,Ninjago: Tournament of Elements,male,2015,Ninjago,https://bricklink.com/v2/catalog/catalogitem.page?M=njo118,2015,East Asian
NA,njo402,Killow,Japanese,70642-1,Killow vs. Samurai X,Ninjago: Sons of Garmadon,male,2018,Ninjago,https://bricklink.com/v2/catalog/catalogitem.page?M=njo402,2018,East Asian
NA,njo223,Kozu - Day of the Departed,Japanese,70596-1,Samurai X Cave Chaos,Ninjago: Day of the Departed,male,2016,Ninjago,https://bricklink.com/v2/catalog/catalogitem.page?M=njo223,2016,East Asian
NA,njo581,Kozu - Legacy,Japanese,71702-1,Golden Mech,Ninjago: Legacy,male,2020,Ninjago,https://bricklink.com/v2/catalog/catalogitem.page?M=njo581,2020,East Asian
NA,njo074,Kozu - The Final Battle,Japanese,70504-1,Garmatron,Ninjago: The Final Battle,male,2013,Ninjago,https://bricklink.com/v2/catalog/catalogitem.page?M=njo074,2013,East Asian
NA,njo120,Krait,Japanese,"70745-1, 70752-1, 891502-1","Anacondrai Crusher, Jungle Trap, Krait foil pack",Ninjago: Tournament of Elements,neutral,2015,Ninjago,https://bricklink.com/v2/catalog/catalogitem.page?M=njo120,2015,East Asian
NA,njo419,Krux (Young),Japanese,5004938-1,"Bricktober Minifigure Collection 1/4 - Ninjago (2017 Toys ""R"" Us Exclusive)",Ninjago: (Other),male,2017,Ninjago,https://bricklink.com/v2/catalog/catalogitem.page?M=njo419,2017,East Asian
NA,njo263,Lil' Nelson,Japanese,70589-1,Rock Roader,Ninjago,male,2016,Ninjago,https://bricklink.com/v2/catalog/catalogitem.page?M=njo263,2016,East Asian
NA,njo167,Lloyd (Deepstone Armor) - Possession,Japanese,"70738-1, 70751-1","Final Flight of Destiny's Bounty, Temple of Airjitzu",Ninjago: Possession,male,2015,Ninjago,https://bricklink.com/v2/catalog/catalogitem.page?M=njo167,2015,East Asian
NA,njo499,Lloyd (Golden Ninja) - Legacy,Japanese,70666-1,The Golden Dragon,Ninjago: Legacy,male,2019,Ninjago,https://bricklink.com/v2/catalog/catalogitem.page?M=njo499,2019,East Asian
NA,njo640,"Lloyd (Golden Ninja) - Legacy, Hair",Japanese,"4002021-1, 71735-1","2021 Employee Exclusive: The Temple of Celebrations, Tournament of Elements",Ninjago: Legacy,male,2021,Ninjago,https://bricklink.com/v2/catalog/catalogitem.page?M=njo640,2021,East Asian
NA,njo073,Lloyd (Golden Ninja) - The Final Battle,Japanese,"71239-1, 70505-1, 70503-1","Fun Pack - Ninjago (Lloyd and Lloyd's Golden Dragon), Temple of Light, The Golden Dragon",Ninjago: The Final Battle,male,2013,Ninjago,https://bricklink.com/v2/catalog/catalogitem.page?M=njo073,2013,East Asian
NA,njo584,"Lloyd (Golden Ninja), Right Shoulder Armor, Pearl Gold Head - Legacy",Japanese,71702-1,Golden Mech,Ninjago: Legacy,male,2020,Ninjago,https://bricklink.com/v2/catalog/catalogitem.page?M=njo584,2020,East Asian
NA,njo654,"Lloyd (Golden Ninja), Right Shoulder Armor, Yellow Head - Legacy",Japanese,71742-1,Overlord Dragon,Ninjago: Legacy,male,2021,Ninjago,https://bricklink.com/v2/catalog/catalogitem.page?M=njo654,2021,East Asian
NA,njo226,Lloyd (Honor Robe) - Day of the Departed,Japanese,70596-1,Samurai X Cave Chaos,Ninjago: Day of the Departed,male,2016,Ninjago,https://bricklink.com/v2/catalog/catalogitem.page?M=njo226,2016,East Asian
NA,njo307,"Lloyd (Honor Robe) - Day of the Departed, Hair and Pearl Gold Shoulder Armor",Japanese,891725-1,Lloyd foil pack #1,Ninjago: Day of the Departed,male,2017,Ninjago,https://bricklink.com/v2/catalog/catalogitem.page?M=njo307,2017,East Asian
NA,njo129,Lloyd (Jungle Robe) - Tournament of Elements,Japanese,70749-1,Enter the Serpent,Ninjago: Tournament of Elements,male,2015,Ninjago,https://bricklink.com/v2/catalog/catalogitem.page?M=njo129,2015,East Asian
NA,njo403,Lloyd (Spinjitzu Masters) - Sons of Garmadon,Japanese,70640-1,S.O.G. Headquarters,Ninjago: Sons of Garmadon: Spinjitzu Masters,male,2018,Ninjago,https://bricklink.com/v2/catalog/catalogitem.page?M=njo403,2018,East Asian
NA,njo104,Lloyd (Stone Warrior Armor) - Rebooted,Japanese,70728-1,Battle for Ninjago City,Ninjago: Rebooted,male,2014,Ninjago,https://bricklink.com/v2/catalog/catalogitem.page?M=njo104,2014,East Asian
